filename,job title,date,year,role,organisation,location,research software engineer
AJF087,research software engineer,2014-07-17,2014,academic or research,the genome analysis centre ,norwich,True
AJF058,research software engineer,2014-07-18,2014,academic or research,nbi partnership ,norwich,True
AJL026,research software engineer in computational biology,2014-08-19,2014,academic or research,university of oxford ,oxford,True
AJR288,scientific programmer / research software engineer,2014-09-26,2014,academic or research,"queen mary, university of london ",e1 4,True
AKH298,research software engineer/senior research software engineer,2015-01-06,2015,academic or research,university of glasgow ,glasgow,True
AKO202,research software engineer lead,2015-02-16,2015,technical,the francis crick institute ,london,True
AKP100,research software engineer,2015-02-20,2015,academic or research,university of oxford ,oxford,True
AKR438,research software engineer,2015-03-05,2015,academic or research,the university of manchester ,manchester,True
ALK840,research software engineer,2015-06-23,2015,academic or research,institute of cancer research ,sutton,True
ALQ781,research software engineer,2015-07-24,2015,academic or research,"the royal veterinary college, university of london ",london,True
ALW865,research software engineer,2015-08-28,2015,professional or managerial,university of oxford ,oxford,True
ALZ256,research software engineer,2015-09-11,2015,technical,university of sheffield ,sheffield,True
AMM982,research software engineer,2015-11-26,2015,academic or research,king's college london ,london,True
AMO779,research software engineer (knowledge transfer partnership associate),2015-12-07,2015,academic or research,king's college london ,london,True
AMP672,research software engineer,2015-12-11,2015,academic or research,university of oxford ,oxford,True
AMP912,research software engineer (erc),2015-12-17,2015,academic or research,open university ,milton keynes,True
AMR609,research software engineer (knowledge transfer partnership associate),2015-12-22,2015,academic or research,king's college london ,london,True
AMZ749,research software engineer,2016-02-12,2016,professional or managerial,the university of manchester ,manchester,True
AMZ811,research software engineer,2016-02-12,2016,professional or managerial,the university of manchester ,manchester,True
ANA818,research software engineer,2016-02-18,2016,professional or managerial,university of oxford ,oxford,True
AUD286,research software engineering specialists,2016-03-09,2016,professional or managerial,university of leicester ,leicester,True
ANE742,research software engineer,2016-03-10,2016,academic or research,durham university ,durham,True
AUD990,research software engineering specialist,2016-04-05,2016,professional or managerial,university of leicester ,leicester,True
ANJ536,research software engineer,2016-04-06,2016,academic or research,university of liverpool ,liverpool,True
ANM463,research associate/research software engineer in massive scale complex systems simulation with accelerated computing,2016-04-20,2016,academic or research,university of sheffield ,sheffield,True
ANM318,brissynbio junior research software engineer and junior hpc systems administrator,2016-04-20,2016,technical,university of bristol ,bristol,True
ANN074,senior research software engineer,2016-04-22,2016,professional or managerial,the university of manchester ,manchester,True
ANQ163,research software engineers (3 posts),2016-05-11,2016,academic or research,the university of manchester ,manchester,True
ANR235,digital preservation specialist - technical officer/research software engineer (polonsky fellow),2016-05-16,2016,technical,university of oxford ,oxford,True
ANR690,research software engineer,2016-05-18,2016,academic or research,stfc ,warrington,True
ANT812,research software engineer,2016-05-26,2016,technical,university of sheffield ,sheffield,True
ANY099,research software engineer,2016-06-16,2016,academic or research,the alan turing institute ,london,True
AOB336,research software engineer,2016-07-01,2016,academic or research,university of southampton ,southampton,True
AOH363,research software engineer,2016-08-02,2016,academic or research,university of sheffield ,sheffield,True
AOI656,research software engineer associate - exploiting the exascale,2016-08-09,2016,academic or research,university of oxford ,oxford,True
AOK408,research software engineer - grade 7,2016-08-17,2016,academic or research,university of liverpool ,liverpool,True
AOL223,research software engineer for radiotherapy,2016-08-22,2016,academic or research,institute of cancer research ,sutton,True
AUI122,research software engineering specialist,2016-08-24,2016,professional or managerial,university of leicester ,leicester,True
AUL740,d48559t - research software engineer (myplace),2016-09-26,2016,academic or research,newcastle university ,newcastle upon tyne,True
AUL743,d48626t - research software engineer (prototyping),2016-09-26,2016,academic or research,newcastle university ,newcastle upon tyne,True
AUL729,d48655t - research software engineer (linguacuisine),2016-09-26,2016,academic or research,newcastle university ,newcastle upon tyne,True
AUT003,d48626t2 - research software engineer (prototyping),2016-10-10,2016,academic or research,newcastle university ,newcastle upon tyne,True
AUV903,research software engineer,2016-10-14,2016,academic or research,university of edinburgh ,edinburgh,True
AUY284,digital preservation specialist - technical officer/research software engineer (polonsky fellow),2016-10-19,2016,academic or research,university of oxford ,oxford,True
AVN478,research software engineer: data analytics,2016-11-15,2016,academic or research,durham university ,durham,True
AWI701,research software engineer (78904-126),2016-12-22,2016,academic or research,university of warwick ,coventry,True
AWL142,d56215t - senior research software engineer,2017-01-04,2017,technical,newcastle university ,newcastle upon tyne,True
AWX124,research software engineer (research associate),2017-01-25,2017,academic or research,cardiff university ,cardiff,True
AXE794,senior research software engineer,2017-02-07,2017,professional or managerial,loughborough university ,loughborough,True
AXE395,research software engineer,2017-02-07,2017,academic or research,university of sheffield ,sheffield,True
AXK916,senior research software engineer,2017-02-17,2017,academic or research,the university of manchester ,manchester,True
AXW017,senior research software engineer,2017-03-08,2017,academic or research,uk atomic energy authority ukaea ,"culham, oxford",True
AYA661,hpc specialist/research software engineer,2017-03-16,2017,academic or research,university of york ,york,True
AYF348,research software engineer,2017-03-24,2017,academic or research,university of sheffield ,sheffield,True
AYE210,scientific programmer / research software engineer,2017-03-29,2017,academic or research,queen mary university of london ,city of london,True
AYH638,post - doctoral research software engineer,2017-03-29,2017,academic or research,cambridge crystallographic data centre ,cambridge,True
AYI720,senior research software engineer (research fellow),2017-03-30,2017,academic or research,cardiff university ,cardiff,True
AYL632,senior research software engineer (research fellow),2017-04-04,2017,academic or research,cardiff university ,cardiff,True
AYQ313,research software engineer,2017-04-12,2017,academic or research,university of bath ,bath,True
AYR840,research software engineer,2017-04-13,2017,academic or research,cardiff university ,cardiff,True
AYR552,research software engineer (research associate) stem,2017-04-13,2017,academic or research,bangor university ,bangor,True
AYR546,research software engineer (research associate) bio,2017-04-13,2017,academic or research,bangor university ,bangor,True
BAZ272,research software engineer,2017-04-27,2017,academic or research,lancaster university ,lancaster,True
BAZ095,research software engineer – gravitational physics and astonomy,2017-04-27,2017,academic or research,cardiff university ,cardiff,True
BBB533,senior research software engineer,2017-05-02,2017,professional or managerial,loughborough university ,loughborough,True
BBC613,research software engineer,2017-05-03,2017,academic or research,university of bristol ,bristol,True
BBE926,senior research software engineer (supercomputing wales),2017-05-08,2017,academic or research,swansea university ,swansea,True
BBE930,research software engineer (supercomputing wales),2017-05-08,2017,academic or research,swansea university ,swansea,True
BBF770,research software engineering team lead,2017-05-09,2017,academic or research,imperial college london ,london,True
BBF844,supercomputing wales – research software engineer (research associate),2017-05-09,2017,academic or research,cardiff university ,cardiff,True
BBG668,research software engineer – gravitational physics and astonomy,2017-05-10,2017,academic or research,cardiff university ,cardiff,True
BBG511,research software engineer,2017-05-10,2017,academic or research,university of southampton ,southampton,True
BBL695,d68385t - senior research software engineer (urban observatory),2017-05-18,2017,academic or research,newcastle university ,newcastle upon tyne,True
BBN749,research software engineer in high performance computing (hpc) enabled multi-scale modelling,2017-05-22,2017,academic or research,university of sheffield ,sheffield,True
BBY646,research software engineer (research associate),2017-06-08,2017,academic or research,cardiff university ,cardiff,True
BCK685,research software engineer,2017-06-28,2017,academic or research,bournemouth university ,poole,True
BCO724,senior research software engineer,2017-07-05,2017,academic or research,loughborough university ,loughborough,True
BCQ374,research software engineering associate,2017-07-07,2017,professional or managerial,university of oxford ,oxford,True
BCR550,research software engineer,2017-07-10,2017,academic or research,the alan turing institute ,london,True
BCU929,senior research software engineer,2017-07-17,2017,academic or research,university of birmingham ,birmingham,True
BCX418,research assistant/associate (research software engineer) (d76606r),2017-07-19,2017,academic or research,newcastle university ,newcastle upon tyne,True
BDG175,research software engineer: optimisation and decision-making,2017-08-01,2017,academic or research,university of sheffield ,sheffield,True
BDG171,research software engineer,2017-08-01,2017,academic or research,cardiff university ,cardiff,True
BDG755,global change research software engineer,2017-08-02,2017,academic or research,university of edinburgh ,edinburgh,True
BDJ500,research software engineer for composites simulations in the bristol composites institute,2017-08-07,2017,academic or research,university of bristol ,bristol,True
BDY660,research software engineer,2017-09-01,2017,academic or research,cardiff university ,cardiff,True
BEC468,research software engineer,2017-09-07,2017,academic or research,stfc ,harwell,True
BED243,research software engineer: optimisation and decision-making,2017-09-08,2017,academic or research,university of sheffield ,sheffield,True
BEG125,research software engineer in mobile computing for mobility and fitness,2017-09-13,2017,academic or research,university of sheffield ,sheffield,True
BEH587,research software engineer,2017-09-15,2017,academic or research,stfc ,daresbury,True
BEQ137,research software engineer in computer-assisted fetal therapy,2017-10-02,2017,academic or research,university college london ,london,True
BEX353,research software engineer,2017-10-12,2017,academic or research,stfc ,daresbury,True
BFF396,research software engineer in data science,2017-10-26,2017,academic or research,university of warwick ,coventry,True
BFH267,research software engineer in computer-assisted fetal therapy,2017-10-30,2017,academic or research,university college london ,london,True
BFO659,research software engineer,2017-11-09,2017,academic or research,university of nottingham ,nottingham,True
BFO432,senior research software engineer,2017-11-09,2017,academic or research,imperial college london ,london,True
BFP216,research software engineering specialist,2017-11-10,2017,professional or managerial,university of leicester ,leicester,True
BFP459,research software engineer in cognitive neuroscience,2017-11-10,2017,academic or research,university college london ,london,True
BFT709,research software engineer,2017-11-16,2017,academic or research,university of southampton ,southampton,True
BFV358,research software engineer - d94705t,2017-11-20,2017,academic or research,newcastle university ,newcastle upon tyne,True
BGB950,bioinformatician / research software engineer,2017-11-29,2017,academic or research,"st george's, university of london ",london,True
BGD504,research software engineer,2017-12-01,2017,professional or managerial,university of birmingham ,birmingham,True
BGG347,research software engineer in mobile computing,2017-12-06,2017,academic or research,university of sheffield ,sheffield,True
BGJ390,research software engineer,2017-12-12,2017,academic or research,university of glasgow ,glasgow,True
BGO137,research software engineer in optimization and decision-making,2017-12-19,2017,academic or research,university of sheffield ,sheffield,True
BGQ170,research software engineer,2017-12-21,2017,academic or research,the alan turing institute ,"london, british library",True
BGQ554,research software engineer in high performance multi agent simulation,2017-12-22,2017,academic or research,university of sheffield ,sheffield,True
BHH204,research software engineer,2018-01-26,2018,academic or research,university of birmingham ,birmingham,True
BHI835,future food beacon: technologist - research software engineer,2018-01-29,2018,academic or research,university of nottingham ,sutton bonington,True
BHL213,bioinformatics scientist/research software engineer,2018-02-01,2018,academic or research,university of dundee ,dundee,True
BHL993,research software engineer,2018-02-02,2018,academic or research,university of york ,york,True
BHN398,research software engineer (super computing wales),2018-02-05,2018,academic or research,swansea university ,swansea,True
BHO040,research software engineering associate in high performing computing,2018-02-06,2018,academic or research,university of oxford ,oxford,True
BIA392,head of research software engineering,2018-02-26,2018,academic or research,university college london ,london,True
BIF170,research software engineer,2018-03-06,2018,no_data,stfc ,daresbury,True
BIG760,senior research fellow / senior research software engineer in lower-middle income country prosthetics databases,2018-03-08,2018,academic or research,university of southampton ,southampton,True
BIJ584,senior/principal research software engineer – high performance computing,2018-03-13,2018,academic or research,the alan turing institute ,london,True
BIK036,research software engineer (3 positions - fixed-term),2018-03-13,2018,academic or research,university of nottingham ,nottingham,True
BIQ916,research software engineer in medical device software engineering,2018-03-23,2018,academic or research,the university of edinburgh ,edinburgh,True
BIV969,analysis research software engineer,2018-04-03,4-03,professional or managerial,university of oxford ,oxford,True
BJD729,research software engineer (research associate),2018-04-16,4-16,academic or research,cardiff university ,cardiff,True
BJJ393,research software engineer,2018-04-25,4-25,academic or research,the university of manchester ,manchester,True
BJR095,"research software engineer on the neon study (fixed term, with optional phd studentship)",2018-05-09,5-09,academic or research,university of nottingham ,nottingham,True
BKA748,research software engineer - d128949t,2018-05-24,5-24,academic or research,newcastle university ,newcastle upon tyne,True
BKD026,research software engineer,2018-05-29,5-29,academic or research,swansea university ,swansea,True
BKU288,two research software engineers for the department of bioscience (postdocs/research assistants),2018-06-29,6-29,academic or research,university of aarhus ,rønde - denmark,True
BKZ893,research software engineer in mobile computing,2018-07-03,7-03,academic or research,university of sheffield ,sheffield,True
BKZ652,research software engineer in mobile computing,2018-07-03,7-03,academic or research,university of sheffield ,sheffield,True
BLB265,senior research software engineer,2018-07-05,7-05,academic or research,uk atomic energy authority ukaea ,oxford,True
BLM533,research software engineer (fixed term),2018-07-23,7-23,academic or research,university of cambridge ,cambridge,True
BLP801,research software engineer,2018-07-27,2018,no_data,imperial college london            ,london,True
BLU017,scientific programmer/research software engineer (rse) - 2 vacancies - qmul15191,2018-08-03,2018,no_data,queen mary university of london            ,london,True
BLU399,analysis research software engineer,2018-08-03,2018,no_data,university of oxford            ,oxford,True
BLX139,research software engineer in cloud infrastructure solutions,2018-08-08,2018,no_data,university of leeds            ,leeds,True
BLW681,research software engineer (2 positions available),2018-08-08,2018,no_data,the university of manchester,manchester,True
BLX158,research software engineer in healthcare data analytics solutions,2018-08-08,2018,no_data,university of leeds            ,leeds,True
BLX122,research software engineer,2018-08-08,2018,no_data,university of southampton            ,southampton,True
BMB748,research software engineer,2018-08-15,2018,no_data,the university of edinburgh            ,edinburgh,True
BML314,research software engineer,2018-08-31,2018,no_data,diamond light source,didcot,True
BMM870,digital research scientist - research software engineer (fixed term project based),2018-09-03,2018,no_data,university of nottingham            ,nottingham,True
BMO310,research software engineer,2018-09-05,2018,no_data,the open university            ,milton keynes,True
BMR948,research software engineer (fixed term),2018-09-11,2018,academic or research,university of bath            ,bath,True
BMT082,research software engineer - digital institute - d151380t,2018-09-13,2018,academic or research,newcastle university            ,newcastle upon tyne,True
BMT739,research software engineer - ad2158sb,2018-09-14,2018,academic or research,university of st andrews            ,saint andrews,True
BMV238,digital research scientist (research software engineer) (fixed term project based) is294318,2018-09-17,2018,academic or research,university of nottingham            ,sutton bonington,True
BNE418,research software engineer (hpc),2018-10-02,2018,professional or managerial,university of birmingham            ,birmingham,True
BNJ857,research software engineer (rse),2018-10-11,2018,academic or research,university of sheffield            ,sheffield,True
BNK696,postdoctoral research fellow (research software engineer),2018-10-12,2018,academic or research,university of exeter            ,exeter,True
BNQ086,research software engineer,2018-10-22,2018,academic or research,stfc ,daresbury,True
BOC332,research software engineer,2018-11-09,2018,academic or research,university of cambridge            ,cambridge,True
BOH936,research software engineer (fixed-term post),2018-11-19,2018,academic or research,university of bath,bath,True
BOU046,research software engineer,2018-12-07,2018,academic or research,uk atomic energy authority ukaea,culham,True
BOW259,senior research software engineer,2018-12-12,2018,professional or managerial,imperial college london            ,london,True
BPC378,postdoctoral research fellow (research software engineer),2018-12-20,2018,academic or research,university of exeter            ,exeter,True
BOW030,research software engineer - d178425t,2018-12-20,2018,academic or research,newcastle university            ,newcastle upon tyne,True
BPC281,research software engineer,2018-12-20,2018,technical,the university of manchester            ,manchester,True
BPD730,research software engineer,2018-12-21,2018,academic or research,university of leeds            ,leeds,True
BPD505,head of research software engineering,2018-12-21,2018,academic or research,durham university            ,durham,True
BPD584,digital humanities research software engineer,2018-12-21,2018,academic or research,british library            ,london,True
BPG279,bioinformatics research software engineer,2019-01-04,2019,academic or research,university of oxford            ,oxford,True
BPH609,research software engineer,2019-01-07,2019,academic or research,university of leeds            ,leeds,True
BPJ981,senior research software engineer (rse) - assistant director of rse sheffield,2019-01-10,2019,academic or research,university of sheffield            ,sheffield,True
BPL166,"research software engineer, exceed",2019-01-11,2019,academic or research,university of leicester            ,leicester,True
BPO695,research software engineer (2 posts),2019-01-17,2019,academic or research,university of oxford            ,oxford,True
BPQ628,research software engineer,2019-01-21,2019,academic or research,european molecular biology laboratory (embl),heidelberg - germany,True
BPV324,research software engineer,2019-01-29,2019,academic or research,british library,london,True
BPW393,research software engineer,2019-01-30,2019,academic or research,imperial college london            ,london,True
BPZ998,research software engineer,2019-02-05,2019,technical,university of bath            ,bath,True
BQC355,research software engineer (fixed term),2019-02-08,2019,academic or research,university of nottingham            ,nottingham,True
BQC087,research software engineer,2019-02-08,2019,academic or research,university of bristol            ,bristol,True
BQE185,senior research software engineer (rse) - assistant director of rse sheffield,2019-02-12,2019,academic or research,university of sheffield            ,sheffield,True
BQC335,research software engineer,2019-02-12,2019,academic or research,university of nottingham            ,nottingham,True
BQF846,research software engineer,2019-02-14,2019,academic or research,university of oxford            ,oxford,True
BQI715,research software engineer,2019-02-20,2019,academic or research,manchester metropolitan university            ,manchester,True
BQM647,research software engineer,2019-02-26,2019,academic or research,university of oxford            ,oxford,True
BQQ153,research software engineer,2019-03-04,2019,academic or research,university of oxford            ,oxford,True
BQQ487,research software engineer,2019-03-05,2019,technical,university of bath            ,bath,True
BQQ563,research software engineer - d178425t2,2019-03-05,2019,academic or research,newcastle university            ,newcastle upon tyne,True
BQU755,research software engineer (workflows for computational discovery of porous materials) grade 7,2019-03-12,2019,academic or research,university of liverpool            ,liverpool,True
BQV572,research software engineer,2019-03-13,2019,academic or research,university of southampton            ,southampton,True
BQY397,research software engineer,2019-03-18,2019,academic or research,university of nottingham            ,nottingham,True
BRC232,research software engineer,2019-03-25,2019,academic or research,university of leeds            ,leeds,True
BRD614,research software engineer (rse) (101392-039),2019-03-27,2019,academic or research,university of warwick            ,coventry,True
BRG485,research software engineer,2019-04-01,2019,academic or research,stfc ,warrington,True
BRG472,global change research software engineer,2019-04-01,2019,academic or research,the university of edinburgh            ,edinburgh,True
BRG758,research software engineer,2019-04-01,2019,academic or research,northumbria university,newcastle upon tyne,True
BRH176,senior research software engineer,2019-04-02,2019,academic or research,northumbria university            ,newcastle upon tyne,True
BRI066,research software engineer,2019-04-03,2019,academic or research,stfc ,warrington,True
BRI897,research software engineer (up to 3 positions),2019-04-04,2019,academic or research,durham university            ,durham,True
BRO073,bioinformatics research software engineer,2019-04-12,2019,academic or research,university of oxford            ,oxford,True
BRP380,associate research software engineer,2019-04-15,2019,academic or research,university of york            ,york,True
BRU242,research software engineer - front end developer,2019-04-24,2019,academic or research,university of oxford            ,oxford,True
BRW050,research software engineering specialist,2019-04-26,2019,academic or research,university of leicester            ,leicester,True
BRW895,machine learning in medical imaging research software engineer,2019-04-29,2019,academic or research,university of oxford            ,oxford,True
BRY122,research data scientist/research software engineer,2019-04-30,2019,academic or research,the alan turing institute,london,True
BRZ596,research software engineer - fixed term 12 months,2019-05-02,2019,academic or research,heriot,edinburgh,True
BSD006,research software engineer - d216756a,2019-05-09,2019,professional or managerial,newcastle university            ,newcastle upon tyne,True
BSG168,research software engineers,2019-05-15,2019,academic or research,king's college london            ,london,True
BSI376,research software engineer (fixed-term post),2019-05-17,2019,academic or research,university of bath            ,bath,True
BSJ389,research software engineer (fixed-term post),2019-05-20,2019,academic or research,university of bath            ,bath,True
BSK211,research software engineer,2019-05-21,2019,academic or research,university of york            ,york,True
BSL279,research software engineer/database programmer,2019-05-22,2019,academic or research,university of oxford            ,oxford,True
